professor_name,prof_gender_finalized,department_name_clean,department_domain,star_rating,star_rating_category,comments,comments_original,comments_scrubbed,comments_original_neg,comments_scrubbed_neg
Sukumar N.  Nabanita,female,Economics,Humanities,2.4,poor,"class started easily enough, moving at fast pace but simple concepts easy to follow, but as the concepts got harder, she did not slow down,hard to stay awake in that class. but keeps students up to date on material by posting all lectures online. she wants everyone to do well but unfortunately not the most enthusiastic teacher.",class start easily move fast pace simple concept easy follow concept get harder she do not slow downhard stay awake class keep student date material post lecture online she want unfortunately not enthusiastic teacher,class start easily move fast pace simple concept easy follow concept get harder do not slow downhard stay awake class keep student date material post lecture online want unfortunately not enthusiastic teacher,class start easily move fast pace simple concept easy follow concept get harder she do not NEG_slow downhard stay awake class keep student date material post lecture online she want unfortunately not NEG_enthusiastic teacher,class start easily move fast pace simple concept easy follow concept get harder do not NEG_slow downhard stay awake class keep student date material post lecture online want unfortunately not NEG_enthusiastic teacher
Sukumar N.  Nabanita,female,Economics,Humanities,2.4,poor,"She was very boring and read exactly off her power points. Her tests were very hard. She asked every five minutes if anyone had any questions, but wasn\'t very helpful. Almost everyone didn\'t have a clue what was going on, including me!",she very bore read exactly her power point her test very hard she ask minute question not very helpful do not clue go include,very bore read exactly power point test very hard ask minute question not very helpful do not clue go include,she very bore read exactly her power point her test very hard she ask minute question not NEG_very helpful do not NEG_clue go include,very bore read exactly power point test very hard ask minute question not NEG_very helpful do not NEG_clue go include
Sukumar N.  Nabanita,female,Economics,Humanities,2.4,poor,"terrible, hard to understand, doesn\'t care about the students at all. in 50 minutes she said okay 111 times. she knows what she is talking about, just doesn\'t have a clue in the world as to how to teach.",terrible hard understand do not care student 50 minute she say okay 111 time she know she talk just do not clue world teach,terrible hard understand do not care student 50 minute say okay 111 time know talk just do not clue world teach,terrible hard understand do not NEG_care student 50 minute she say okay 111 time she know she talk just do not NEG_clue world teach,terrible hard understand do not NEG_care student 50 minute say okay 111 time know talk just do not NEG_clue world teach
Sukumar N.  Nabanita,female,Economics,Humanities,2.4,poor,"Horrible teacher!!!! Not helpful at all, runs through things like we\'re all economists...and it\'s a 100 level course!!! Hard to understand because she talks too soft. Don\'t take her class unless absolutley needed!!",horrible teacher not helpful run thing like economistsand 100 level course hard understand she talk too soft not her class unless absolutley need,horrible teacher not helpful run thing like economistsand 100 level course hard understand talk too soft not class unless absolutley need,horrible teacher not NEG_helpful run thing like economistsand 100 level course hard understand she talk too soft not NEG_her class unless absolutley need,horrible teacher not NEG_helpful run thing like economistsand 100 level course hard understand talk too soft not NEG_class unless absolutley need
Corsi  Crews,female,Criminal Justice,Humanities,1.0,poor,She is by far the WORSE teacher. She did not focus on the subject and wanted to discuss her personal life. She was not professional. She was not consice in her directions for assignments or did she properly review us for tests,she far worse teacher she do not focus subject want discus her personal life she not professional she not consice her direction assignment do she properly review test,far worse teacher do not focus subject want discus personal life not professional not consice direction assignment do properly review test,she far worse teacher she do not NEG_focus subject want discus her personal life she not NEG_professional she not NEG_consice her direction assignment do she properly review test,far worse teacher do not NEG_focus subject want discus personal life not NEG_professional not NEG_consice direction assignment do properly review test
Corsi  Crews,female,Criminal Justice,Humanities,1.0,poor,"I enrolled in her juv. deliquency class during fall 08. I\'m a CJ minor so I know my stuff, but I felt as if she was more interest in Psychology than CJ. I felt uneasy about the tests but I always did fine. I\'m one that needs a review and it made me nervous to not receive one!She\'s a nice person but not a good teacher.",enrol her juv deliquency class fall 08 cj minor so know stuff felt she psychology cj felt uneasy test do fine need review nervous not receive oneshe nice person not good teacher,enrol juv deliquency class fall 08 cj minor so know stuff felt psychology cj felt uneasy test do fine need review nervous not receive oneshe nice person not good teacher,enrol her juv deliquency class fall 08 cj minor so know stuff felt she psychology cj felt uneasy test do fine need review nervous not NEG_receive oneshe nice person not NEG_good teacher,enrol juv deliquency class fall 08 cj minor so know stuff felt psychology cj felt uneasy test do fine need review nervous not NEG_receive oneshe nice person not NEG_good teacher
Nina  Bartlett,female,Business,Humanities,1.5,poor,This teacher uses powerpoint and lectures to teach. She moves too quickly through material and taking notes is difficult because of the pace. She does not offer much help or support to students who struggle to keep up.,teacher use powerpoint lecture teach she move too quickly material take note difficult pace she do not offer help support student struggle,teacher use powerpoint lecture teach move too quickly material take note difficult pace do not offer help support student struggle,teacher use powerpoint lecture teach she move too quickly material take note difficult pace she do not NEG_offer help support student struggle,teacher use powerpoint lecture teach move too quickly material take note difficult pace do not NEG_offer help support student struggle
Kayla  Whitman,female,English,Humanities,1.5,poor,she\'s not nice at all and has no regard for why your absent even if it is a death in the family.,she not nice no regard absent death family,not nice no regard absent death family,she not NEG_nice no NEG_regard absent death family,not NEG_nice no NEG_regard absent death family
Kayla  Whitman,female,English,Humanities,1.5,poor,rude,rude,rude,rude,rude
Kayla  Whitman,female,English,Humanities,1.5,poor,stuck up races and hate to be wrong she need to treat people with respect and lose and leave her personal buss at home and smile sometimes,stick race hate wrong she need treat people respect lose leave her personal bus home smile,stick race hate wrong need treat people respect lose leave personal bus home smile,stick race hate wrong she need treat people respect lose leave her personal bus home smile,stick race hate wrong need treat people respect lose leave personal bus home smile
Kayla  Whitman,female,English,Humanities,1.5,poor,"Extremely easy class. I felt like I was a better writer than Kayla though, which was a pretty big putoff.",extremely easy class felt like better writer kayla pretty big putoff,extremely easy class felt like better writer kayla pretty big putoff,extremely easy class felt like better writer kayla pretty big putoff,extremely easy class felt like better writer kayla pretty big putoff
Michaela  Sanielevici,female,Finance,Humanities,1.4,poor,"stay away!!! I cant believe she still teaching, I guess Ryerson is that desperate. I have no words to describe her, its one of those things that leave you speechless bcuz you just dont think there\'s people like that on eath...it makes you wonder how somebody like that has gotten thru life. you gotta experience it yourself to know what i\'m saying!",stay away believe she teach guess ryerson desperate no word her thing leave speechless bcuz just dont think people like eathit make wonder somebody like get life gotta experience know say,stay away believe teach guess ryerson desperate no word thing leave speechless bcuz just dont think people like eathit make wonder somebody like get life gotta experience know say,stay away believe she teach guess ryerson desperate no NEG_word her thing leave speechless bcuz just dont think people like eathit make wonder somebody like get life gotta experience know say,stay away believe teach guess ryerson desperate no NEG_word thing leave speechless bcuz just dont think people like eathit make wonder somebody like get life gotta experience know say
Michaela  Sanielevici,female,Finance,Humanities,1.4,poor,"she\'s alright. not a great prof but does know her stuff. pros:tests are fair. she did try her best to teach imo. cons: she\'s unorganized. class fell behind schedule after 1st test, way behind after 3rd. no teaching skills. the course is tough, totally different from fin 501. better have basic knowledge of derivatives before taking this course.",she alright not great prof do know her stuff prostests fair she do try her best teach imo con she unorganized class fell schedule 1st test way 3rd no teach skill course tough totally different fin 501 better basic knowledge derivative take course,alright not great prof do know stuff prostests fair do try best teach imo con unorganized class fell schedule 1st test way 3rd no teach skill course tough totally different fin 501 better basic knowledge derivative take course,she alright not NEG_great prof do know her stuff prostests fair she do try her best teach imo con she unorganized class fell schedule 1st test way 3rd no NEG_teach skill course tough totally different fin 501 better basic knowledge derivative take course,alright not NEG_great prof do know stuff prostests fair do try best teach imo con unorganized class fell schedule 1st test way 3rd no NEG_teach skill course tough totally different fin 501 better basic knowledge derivative take course
Michaela  Sanielevici,female,Finance,Humanities,1.4,poor,She is below ZERO. Worst prof ever.,she zero worst prof,zero worst prof,she zero worst prof,zero worst prof
Michaela  Sanielevici,female,Finance,Humanities,1.4,poor,worst professor ... not co-operative ... i was about to commit suicide because of her ... v poor teaching skills ... i think ryerson took her .. just because they got no one to teach in the evening .... i have told everyone in my country..on fb n tht ryerson is business minded and does not care for its students... she is ridiculous,worst professor not cooperative commit suicide her v poor teach skill think ryerson take her just get no teach even tell countryon fb n tht ryerson business mind do not care student she ridiculous,worst professor not cooperative commit suicide v poor teach skill think ryerson take just get no teach even tell countryon fb n tht ryerson business mind do not care student ridiculous,worst professor not NEG_cooperative commit suicide her v poor teach skill think ryerson take her just get no NEG_teach even tell countryon fb n tht ryerson business mind do not NEG_care student she ridiculous,worst professor not NEG_cooperative commit suicide v poor teach skill think ryerson take just get no NEG_teach even tell countryon fb n tht ryerson business mind do not NEG_care student ridiculous
Michaela  Sanielevici,female,Finance,Humanities,1.4,poor,Not a helpful prof. In my mind (and others) this class was a waste of time. She could be a great teacher if she wanted to (se expained a few problems when students requested some help)-but no (she prefers easy way out). She wants students to figure out everything themselves. She has very low teaching skills.,not helpful prof mind class waste time she great teacher she want se expained problem student request helpbut no she prefer easy way she want student figure she very low teach skill,not helpful prof mind class waste time great teacher want se expained problem student request helpbut no prefer easy way want student figure very low teach skill,not NEG_helpful prof mind class waste time she great teacher she want se expained problem student request helpbut no NEG_she prefer easy way she want student figure she very low teach skill,not NEG_helpful prof mind class waste time great teacher want se expained problem student request helpbut no NEG_prefer easy way want student figure very low teach skill
Michaela  Sanielevici,female,Finance,Humanities,1.4,poor,Worst prof ever!! Has no clue what she\'s talking about. Makes fun of people. Don\'t take her if you have a choice. I was stuck in her class coz I needed it to graduate.,worst prof no clue she talk make fun people not her choice stick her class coz need graduate,worst prof no clue talk make fun people not choice stick class coz need graduate,worst prof no NEG_clue she talk make fun people not NEG_her choice stick her class coz need graduate,worst prof no NEG_clue talk make fun people not NEG_choice stick class coz need graduate
Michaela  Sanielevici,female,Finance,Humanities,1.4,poor,"WORST prof. ever in my 5 years of college/university experience! Hard to understand, takes long to start tests/exam & classes as she calls everyones name for attendance, makes unnecessary rules like must say your last name first or she\'ll scold you. Went into this course expecting A finished w/ C- my lowest grade this yr. (my highest was A+) BEWARE",worst prof 5 year collegeuniversity experience hard understand take long start testsexam class she call everyones attendance make unnecessary rule like say she scold go course expect finish w c lowest grade yr highest beware,worst prof 5 year collegeuniversity experience hard understand take long start testsexam class call everyones attendance make unnecessary rule like say scold go course expect finish w c lowest grade yr highest beware,worst prof 5 year collegeuniversity experience hard understand take long start testsexam class she call everyones attendance make unnecessary rule like say she scold go course expect finish w c lowest grade yr highest beware,worst prof 5 year collegeuniversity experience hard understand take long start testsexam class call everyones attendance make unnecessary rule like say scold go course expect finish w c lowest grade yr highest beware
Michaela  Sanielevici,female,Finance,Humanities,1.4,poor,"nice lady,maybe very Knowledgeable, but Definitely not a good teacher. I had been trying very very hard to focus on her class, but I failed. totally wasting time going to her class. I have signed up another course this fall, when I found out she is the professor, I swapped.",nice ladymaybe very knowledgeable definitely not good teacher try very very hard focus her class fail totally waste time go her class sign course fall she professor swap,nice ladymaybe very knowledgeable definitely not good teacher try very very hard focus class fail totally waste time go class sign course fall professor swap,nice ladymaybe very knowledgeable definitely not NEG_good teacher try very very hard focus her class fail totally waste time go her class sign course fall she professor swap,nice ladymaybe very knowledgeable definitely not NEG_good teacher try very very hard focus class fail totally waste time go class sign course fall professor swap
Michaela  Sanielevici,female,Finance,Humanities,1.4,poor,"I find her quite condescending, esp. when she says the class is easy and we should know the most of the concepts because it\'s a upper-level finance class. Lacked organization and constantly talked during the midterm. Accent quite thick and keeps using examples from other books, which of course you can\'t refer to later on for examples.",her quite condescend esp she say class easy know concept upperlevel finance class lack organization constantly talk midterm accent quite keep use example book course not refer later example,quite condescend esp say class easy know concept upperlevel finance class lack organization constantly talk midterm accent quite keep use example book course not refer later example,her quite condescend esp she say class easy know concept upperlevel finance class lack organization constantly talk midterm accent quite keep use example book course not NEG_refer later example,quite condescend esp say class easy know concept upperlevel finance class lack organization constantly talk midterm accent quite keep use example book course not NEG_refer later example
Michaela  Sanielevici,female,Finance,Humanities,1.4,poor,"difficult tests,unorganized,took her an hour to get the mid term started",difficult testsunorganizedtook her hour mid term start,difficult testsunorganizedtook hour mid term start,difficult testsunorganizedtook her hour mid term start,difficult testsunorganizedtook hour mid term start
Michaela  Sanielevici,female,Finance,Humanities,1.4,poor,"Extremely difficult course taught by a confusing woman. Rarely went to class because I couldn\'t follow her due to her accent. She does not clarify what she expects and marks difficult on the assignments. However, it is still better to take this course with her over Terry because her final was pretty easy and she focused on the basic stuff.",extremely difficult course teach confuse woman rarely go class not follow her her accent she do not clarify she expect mark difficult assignment better course her terry her final pretty easy she focus basic stuff,extremely difficult course teach confuse rarely go class not follow accent do not clarify expect mark difficult assignment better course terry final pretty easy focus basic stuff,extremely difficult course teach confuse woman rarely go class not NEG_follow her her accent she do not NEG_clarify she expect mark difficult assignment better course her terry her final pretty easy she focus basic stuff,extremely difficult course teach confuse rarely go class not NEG_follow accent do not NEG_clarify expect mark difficult assignment better course terry final pretty easy focus basic stuff
Michaela  Sanielevici,female,Finance,Humanities,1.4,poor,"She\'s a very nice lady that makes jokes and she\'s liberal about working on the assignments together but she has a very thick accent and is very confusing. She does not explain clearly, skips steps and also makes mathematical errors. Literally half of the students get up and walk out of the class by the break. Nice person but extremely confusing.",she very nice lady make joke she liberal work assignment she very accent very confuse she do not explain clearly skip step make mathematical error literally half student walk class break nice person extremely confuse,very nice make joke liberal work assignment very accent very confuse do not explain clearly skip step make mathematical error literally half student walk class break nice person extremely confuse,she very nice lady make joke she liberal work assignment she very accent very confuse she do not NEG_explain clearly skip step make mathematical error literally half student walk class break nice person extremely confuse,very nice make joke liberal work assignment very accent very confuse do not NEG_explain clearly skip step make mathematical error literally half student walk class break nice person extremely confuse
Jania  Levin,female,English,Humanities,2.0,poor,She screws up the attendance and even though you tell her she basically says oh well and still gives you a lower grade. The class is pointless. It is really easy but very boring.,she screw attendance tell her she basically say oh give lower grade class pointless really easy very bore,screw attendance tell basically say oh give lower grade class pointless really easy very bore,she screw attendance tell her she basically say oh give lower grade class pointless really easy very bore,screw attendance tell basically say oh give lower grade class pointless really easy very bore
Ann B.  Stoddard,female,Fine Arts,Humanities,1.2,poor,"She does not care for the student\'s creativity, she is disrespectful, and mean. She is the worse teacher. Makes you spend a lot of money in items that are not necessary for the class. She always try to humiliate students in from of everyone and makes you feel worthless. students walked out class the very first day of the semester. don\'t choose her",she do not care student creativity she disrespectful mean she worse teacher make spend lot money item not necessary class she try humiliate student make feel worthless student walk class very day semester not choose her,do not care student creativity disrespectful mean worse teacher make spend lot money item not necessary class try humiliate student make feel worthless student walk class very day semester not choose,she do not NEG_care student creativity she disrespectful mean she worse teacher make spend lot money item not NEG_necessary class she try humiliate student make feel worthless student walk class very day semester not NEG_choose her,do not NEG_care student creativity disrespectful mean worse teacher make spend lot money item not NEG_necessary class try humiliate student make feel worthless student walk class very day semester not NEG_choose
Ann B.  Stoddard,female,Fine Arts,Humanities,1.2,poor,"She is by far the worst professor I\'ve ever had. She made us spend $200+ on art supplies we never use, had us write a ton of useless papers and is impossible to please. She hates everyone\'s art and is condescending. She even made a girl cry in the middle of class. This woman made me never want to take another art class.",she far worst professor she spend 200 art supply never use write ton useless paper impossible she hat everyones art condescend she girl middle class woman never want art class,far worst professor spend 200 art supply never use write ton useless paper impossible hat everyones art condescend girl middle class never want art class,she far worst professor she spend 200 art supply never NEG_use write ton useless paper impossible she hat everyones art condescend she girl middle class woman never NEG_want art class,far worst professor spend 200 art supply never NEG_use write ton useless paper impossible hat everyones art condescend girl middle class never NEG_want art class
Ann B.  Stoddard,female,Fine Arts,Humanities,1.2,poor,"This is by far the most frustrating teacher I\'ve ever had. She\'s horrible. Never answers the questions we ask and tells us our art is wrong. How can art be ""wrong?"" Plus she\'s no fun to look at. Do not take her for basic design. The projects she assigns require us to spend a minimum of 6-7 hours out of class doing and redoing stupid projects.",far frustrate teacher she horrible never answer question ask tell art wrong art wrong plus she no fun look not her basic design project she assign require spend minimum 67 hour class do redo stupid project,far frustrate teacher horrible never answer question ask tell art wrong art wrong plus no fun look not basic design project assign require spend minimum 67 hour class do redo stupid project,far frustrate teacher she horrible never NEG_answer question ask tell art wrong art wrong plus she no NEG_fun look not NEG_her basic design project she assign require spend minimum 67 hour class do redo stupid project,far frustrate teacher horrible never NEG_answer question ask tell art wrong art wrong plus no NEG_fun look not NEG_basic design project assign require spend minimum 67 hour class do redo stupid project
Ann B.  Stoddard,female,Fine Arts,Humanities,1.2,poor,"One of the WORST teachers in any college let alone SU. She is horrible. Disorganized, rude and condescending to students. I can\'t believe they re-upped her for next semester. She drags the department down. Her assignments were ridiculous and stupid and she forced students to installation even when that is not their focus. She should be fired.",worst teacher college let su she horrible disorganize rude condescend student not believe reupped her semester she drag department her assignment ridiculous stupid she force student installation not focus she fire,worst teacher college let su horrible disorganize rude condescend student not believe reupped semester drag department assignment ridiculous stupid force student installation not focus fire,worst teacher college let su she horrible disorganize rude condescend student not NEG_believe reupped her semester she drag department her assignment ridiculous stupid she force student installation not NEG_focus she fire,worst teacher college let su horrible disorganize rude condescend student not NEG_believe reupped semester drag department assignment ridiculous stupid force student installation not NEG_focus fire
