professor_name,prof_gender_finalized,department_name_clean,department_domain,star_rating,star_rating_category,comments,comments_original,comments_scrubbed,comments_original_neg,comments_scrubbed_neg
Kimberly  Morgan,female,Economics,Humanities,2.2,poor,"Easy homework/discussion board assignments, but tough quizes. There is a quiz every week, but it is not timed which helps a lot. A reasonable work load. Little to no involvement by the professor. An okay class to take if you do plan to major in economics.",easy homeworkdiscussion board assignment tough quiz quiz week not time help lot reasonable work load little no involvement professor okay class plan major economics,easy homeworkdiscussion board assignment tough quiz quiz week not time help lot reasonable work load little no involvement professor okay class plan major economics,easy homeworkdiscussion board assignment tough quiz quiz week not NEG_time help lot reasonable work load little no NEG_involvement professor okay class plan major economics,easy homeworkdiscussion board assignment tough quiz quiz week not NEG_time help lot reasonable work load little no NEG_involvement professor okay class plan major economics
Kimberly  Morgan,female,Economics,Humanities,2.2,poor,"I took her online and thought she was pretty easy. As long as the discussion boards are done every week, you will get a good grade. The quizzes are pretty difficult, but she usually curves them.",take her online think she pretty easy long discussion board week good grade quiz pretty difficult she usually curve,take online think pretty easy long discussion board week good grade quiz pretty difficult usually curve,take her online think she pretty easy long discussion board week good grade quiz pretty difficult she usually curve,take online think pretty easy long discussion board week good grade quiz pretty difficult usually curve
Maria  Tamburrino,female,Music,Humanities,2.2,poor,"Maria\'s teaching methods are definitely not for all. It feels like she uses the same methods as with her younger students (questionable if you ask me). Also, she can be pretty mean to non-music students.",maria teach method definitely not feel like she use method her younger student questionable ask she pretty mean nonmusic student,maria teach method definitely not feel like use method younger student questionable ask pretty mean nonmusic student,maria teach method definitely not NEG_feel like she use method her younger student questionable ask she pretty mean nonmusic student,maria teach method definitely not NEG_feel like use method younger student questionable ask pretty mean nonmusic student
Maria  Tamburrino,female,Music,Humanities,2.2,poor,I\'m glad I switched to Julie McKenzie. She\'s helped me develop my sound so much more than Maria did. Maria also spent way too much time talking about herself in lessons.,glad switch julie mckenzie she help develop sound so maria do maria spend way too time talk lesson,glad switch julie mckenzie help develop sound so maria do maria spend way too time talk lesson,glad switch julie mckenzie she help develop sound so maria do maria spend way too time talk lesson,glad switch julie mckenzie help develop sound so maria do maria spend way too time talk lesson
Maria  Tamburrino,female,Music,Humanities,2.2,poor,"She\'s okay. Somehow, I think she\'s better off teaching little kids because she talks about them so much during lessons.",she okay think she better teach little kid she talk so lesson,okay think better teach little kid talk so lesson,she okay think she better teach little kid she talk so lesson,okay think better teach little kid talk so lesson
Jeanelle  Herrell,female,Psychology,Humanities,1.0,poor,Why is she allowed to teach,she allow teach,allow teach,she allow teach,allow teach
Jeanelle  Herrell,female,Psychology,Humanities,1.0,poor,Incompetent. Poor communication and teaching skills. Should be teaching Kindergarten.,incompetent poor communication teach skill teach kindergarten,incompetent poor communication teach skill teach kindergarten,incompetent poor communication teach skill teach kindergarten,incompetent poor communication teach skill teach kindergarten
Byron  Russell,male,Art,Humanities,2.3,poor,"This professor was really cool. Took 2 classes with Byron as my professor and those classes were fun. He was cool and wasn\'t harsh as other teachers. He helps the student to the most of his ability. Great teacher, Great class! :D",professor really cool take 2 class byron professor class fun he cool not harsh teacher he help student his ability great teacher great class d,professor really cool take 2 class byron professor class fun cool not harsh teacher help student ability great teacher great class d,professor really cool take 2 class byron professor class fun he cool not NEG_harsh teacher he help student his ability great teacher great class d,professor really cool take 2 class byron professor class fun cool not NEG_harsh teacher help student ability great teacher great class d
Byron  Russell,male,Art,Humanities,2.3,poor,"Really hated this class, this teacher was very unporfessional he would rather be friends with his students than acutally be a teacher. He gets upset very easily and takes things to personal. Unmentional things where said in the class room that he allowed because that made him what he wanted to be ""cool"". He writes his own test which make no sense.",really hat class teacher very unporfessional he friend his student acutally teacher he get upset very easily take thing personal unmentional thing say class room he allow him he want cool he write his test make no sense,really hat class teacher very unporfessional friend student acutally teacher get upset very easily take thing personal unmentional thing say class room allow want cool write test make no sense,really hat class teacher very unporfessional he friend his student acutally teacher he get upset very easily take thing personal unmentional thing say class room he allow him he want cool he write his test make no NEG_sense,really hat class teacher very unporfessional friend student acutally teacher get upset very easily take thing personal unmentional thing say class room allow want cool write test make no NEG_sense
Martin  Cohen,male,Anthropology,Humanities,2.4,poor,"He\'s okay. I had to memorize everything in the book, but I was able to get an A. You have to put a lot of energy and time in the class. I am aware this is college, but the work can be a bit unexpectedly rigorous for the subject. His grading system is fair though. He does not respond to emails unless you have a huge emergency. So, go to office hours",he okay memorize book able lot energy time class aware college work bite unexpectedly rigorous subject his grade fair he do not respond email unless huge emergency so office hour,okay memorize book able lot energy time class aware college work bite unexpectedly rigorous subject grade fair do not respond email unless huge emergency so office hour,he okay memorize book able lot energy time class aware college work bite unexpectedly rigorous subject his grade fair he do not NEG_respond email unless huge emergency so office hour,okay memorize book able lot energy time class aware college work bite unexpectedly rigorous subject grade fair do not NEG_respond email unless huge emergency so office hour
Martin  Cohen,male,Anthropology,Humanities,2.4,poor,"The class is super boring, just power point presentations, never explains the homework. You can barely hear him. You really need to read the book to succeed in this class",class super bore just power point presentation never explain homework barely hear him really need read book succeed class,class super bore just power point presentation never explain homework barely hear really need read book succeed class,class super bore just power point presentation never NEG_explain homework barely hear him really need read book succeed class,class super bore just power point presentation never NEG_explain homework barely hear really need read book succeed class
Martin  Cohen,male,Anthropology,Humanities,2.4,poor,"This is a horrible course DO NOT TAKE IT!! At least not with Cohen. He is very monotone, it\'s all slideshows and videos easy to get lost or confused it doesn\'t make much sense and he won\'t explain it. He expects you to know and auto understand!?",horrible course not not cohen he very monotone slideshows video easy lose confuse do not make sense he not explain he expect know auto understand,horrible course not not cohen very monotone slideshows video easy lose confuse do not make sense not explain expect know auto understand,horrible course not NEG_not cohen he very monotone slideshows video easy lose confuse do not NEG_make sense he not NEG_explain he expect know auto understand,horrible course not NEG_not cohen very monotone slideshows video easy lose confuse do not NEG_make sense not NEG_explain expect know auto understand
Martin  Cohen,male,Anthropology,Humanities,2.4,poor,"The worst teacher I\'ve ever taken in college, makes no effort to return assignments so you never know what your grade is! Stay away from him!",worst teacher take college make no effort return assignment so never know grade stay away him,worst teacher take college make no effort return assignment so never know grade stay away,worst teacher take college make no NEG_effort return assignment so never NEG_know grade stay away him,worst teacher take college make no NEG_effort return assignment so never NEG_know grade stay away
Martin  Cohen,male,Anthropology,Humanities,2.4,poor,"If you are a serious student, you will pass. I got an A. Those that complain are the type that barely show up, leave early, don\'t do HW, and don\'t study. Then they wonder why they don\'t pass. They come here and blame the teacher for THEIR failure. Not a bad class at all, don\'t listen to these people.",student pas get complain type barely leave early not hw not study wonder not pas come blame teacher failure not bad class not listen people,student pas get complain type barely leave early not hw not study wonder not pas come blame teacher failure not bad class not listen people,student pas get complain type barely leave early not NEG_hw not NEG_study wonder not NEG_pas come blame teacher failure not NEG_bad class not NEG_listen people,student pas get complain type barely leave early not NEG_hw not NEG_study wonder not NEG_pas come blame teacher failure not NEG_bad class not NEG_listen people
Martin  Cohen,male,Anthropology,Humanities,2.4,poor,Dont take his class Its unbelievable the way he lectures terrible I wish he was more interesting and spoke with a different tone of voice and tries to be so clear and incredibly correct that it gets annoying His study guide has all the chapters mixed up He puts no effort into trying to make his lectures fun and interesting like other professors,dont his class unbelievable way he lecture terrible wish he interest speak different tone voice try so clear incredibly correct get annoy his study guide chapter mix he put no effort try make his lecture fun interest like professor,dont class unbelievable way lecture terrible wish interest speak different tone voice try so clear incredibly correct get annoy study guide chapter mix put no effort try make lecture fun interest like professor,dont his class unbelievable way he lecture terrible wish he interest speak different tone voice try so clear incredibly correct get annoy his study guide chapter mix he put no NEG_effort try make his lecture fun interest like professor,dont class unbelievable way lecture terrible wish interest speak different tone voice try so clear incredibly correct get annoy study guide chapter mix put no NEG_effort try make lecture fun interest like professor
Martin  Cohen,male,Anthropology,Humanities,2.4,poor,"He speaks in a monotone voice & lectures from a power point with the lights off, he\'s asking for people to fall asleep. 85percent of each lecture is off-topic about his random personal opinions. I constantly left class because of his narrow-minded opinions he kept preaching. I was so confused about what the class was even teaching, but I got an A.",he speak monotone voice lecture power point light he ask people fall asleep 85percent lecture offtopic his random personal opinion constantly leave class his narrowminded opinion he keep preach so confuse class teach get,speak monotone voice lecture power point light ask people fall asleep 85percent lecture offtopic random personal opinion constantly leave class narrowminded opinion keep preach so confuse class teach get,he speak monotone voice lecture power point light he ask people fall asleep 85percent lecture offtopic his random personal opinion constantly leave class his narrowminded opinion he keep preach so confuse class teach get,speak monotone voice lecture power point light ask people fall asleep 85percent lecture offtopic random personal opinion constantly leave class narrowminded opinion keep preach so confuse class teach get
Martin  Cohen,male,Anthropology,Humanities,2.4,poor,Easy class. People that complain are obviously lazy. This is college people. Study and you will pass.,easy class people complain obviously lazy college people study pas,easy class people complain obviously lazy college people study pas,easy class people complain obviously lazy college people study pas,easy class people complain obviously lazy college people study pas
Martin  Cohen,male,Anthropology,Humanities,2.4,poor,"He does lecture alot, so you dont get lot of time to take notes BUT he has a study guide online if you follow that you can pass. thats what I did and i got a B also there is homework everyweek but uts realy easy",he do lecture alot so dont lot time note he study guide online follow pas thats do get b homework everyweek ut realy easy,do lecture alot so dont lot time note study guide online follow pas thats do get b homework everyweek ut realy easy,he do lecture alot so dont lot time note he study guide online follow pas thats do get b homework everyweek ut realy easy,do lecture alot so dont lot time note study guide online follow pas thats do get b homework everyweek ut realy easy
Martin  Cohen,male,Anthropology,Humanities,2.4,poor,"I LOVED his class! He\'s so jolly, funny and extremely helpful. His quizes and tests are not too hard as long as you do the homework and study a bit. His class is very interesting, and informative. Prior to Mr. Cohen\'s class, I was not interested in Anthropology, let alone Linguistic Anthro, but after his class I now absolutely love it. A+ Teacher.",love his class he so jolly funny extremely helpful his quiz test not too hard long homework study bite his class very interest informative prior mr cohens class not interest anthropology let linguistic anthro his class absolutely love teacher,love class so jolly funny extremely helpful quiz test not too hard long homework study bite class very interest informative prior mr cohens class not interest anthropology let linguistic anthro class absolutely love teacher,love his class he so jolly funny extremely helpful his quiz test not NEG_too hard long homework study bite his class very interest informative prior mr cohens class not NEG_interest anthropology let linguistic anthro his class absolutely love teacher,love class so jolly funny extremely helpful quiz test not NEG_too hard long homework study bite class very interest informative prior mr cohens class not NEG_interest anthropology let linguistic anthro class absolutely love teacher
Martin  Cohen,male,Anthropology,Humanities,2.4,poor,"This is the worst teacher at Mission (also teaches at CSUN). He is so boring! and he laughs at his lame jokes, its pathetic. Mandatory textbooks, attending class, no one looked forward to this class. Take anyone but Cohen, if you can, trust me.",worst teacher mission teach csun he so bore he laugh his lame joke pathetic mandatory textbook attend class no look forward class cohen trust,worst teacher mission teach csun so bore laugh lame joke pathetic mandatory textbook attend class no look forward class cohen trust,worst teacher mission teach csun he so bore he laugh his lame joke pathetic mandatory textbook attend class no NEG_look forward class cohen trust,worst teacher mission teach csun so bore laugh lame joke pathetic mandatory textbook attend class no NEG_look forward class cohen trust
Kate  Kirchner,female,Communication,Humanities,1.5,poor,"The worst professor I have ever had. She glares at anyone who dares to get up in the middle of class to go to the bathroom, yet sometimes wouldn\'t even give an official break during our 3.5 hour class. She\'s also incredibly unorganized and I sometimes doubted her knowledge of the information she taught.",worst professor she glare dare middle class bathroom not official break 35 hour class she incredibly unorganized doubt her knowledge information she teach,worst professor glare dare middle class bathroom not official break 35 hour class incredibly unorganized doubt knowledge information teach,worst professor she glare dare middle class bathroom not NEG_official break 35 hour class she incredibly unorganized doubt her knowledge information she teach,worst professor glare dare middle class bathroom not NEG_official break 35 hour class incredibly unorganized doubt knowledge information teach
Kate  Kirchner,female,Communication,Humanities,1.5,poor,I feel so bad for anyone who has this teacher. She complains about her students all the time! She has a limited public speaking background. Students in this class are treated like they are in high school. She has very little sympathy for the students with anxiety. She takes up class time with complaining instead of teaching. Drop this class!,feel so bad teacher she complain her student time she limit public speak background student class treat like high school she very little sympathy student anxiety she take class time complain instead teach drop class,feel so bad teacher complain student time limit public speak background student class treat like high school very little sympathy student anxiety take class time complain instead teach drop class,feel so bad teacher she complain her student time she limit public speak background student class treat like high school she very little sympathy student anxiety she take class time complain instead teach drop class,feel so bad teacher complain student time limit public speak background student class treat like high school very little sympathy student anxiety take class time complain instead teach drop class
Seneca  Joyner,female,History,Humanities,1.8,poor,"Her advice word-for-word: ""Know everything."" OK, let me just drop out of my 3 other classes, lock myself away with a group of monks for the duration of the semester and memorize these bi-weekly 30-60 page readings by heart. I never wish upon *anyone* to lose their job but if I had to make a list of candidates, she\'d be very high on it.",her advice wordforword know ok let just drop 3 class lock away group monk duration semester memorize biweekly 3060 page reading heart never wish lose job make list candidate she very high,advice wordforword know ok let just drop 3 class lock away group monk duration semester memorize biweekly 3060 page reading heart never wish lose job make list candidate very high,her advice wordforword know ok let just drop 3 class lock away group monk duration semester memorize biweekly 3060 page reading heart never NEG_wish lose job make list candidate she very high,advice wordforword know ok let just drop 3 class lock away group monk duration semester memorize biweekly 3060 page reading heart never NEG_wish lose job make list candidate very high
Seneca  Joyner,female,History,Humanities,1.8,poor,Had her first semester freshman year and HATED this class. She ruined my interest in Latin America. She\'s opinionated and a super hard grader. It\'s a level 1000 class and she grades like it a 4000 level. Failed the midterm despite crazy studying. Miraculously passed the final. I liked her as a person - go to office hours - but terrible prof.,her semester freshman year hat class she ruin latin america she opinionated super hard grader level 1000 class she grade like 4000 level fail midterm despite crazy study miraculously pas final like her person office hour terrible prof,semester freshman year hat class ruin latin america opinionated super hard grader level 1000 class grade like 4000 level fail midterm despite crazy study miraculously pas final like person office hour terrible prof,her semester freshman year hat class she ruin latin america she opinionated super hard grader level 1000 class she grade like 4000 level fail midterm despite crazy study miraculously pas final like her person office hour terrible prof,semester freshman year hat class ruin latin america opinionated super hard grader level 1000 class grade like 4000 level fail midterm despite crazy study miraculously pas final like person office hour terrible prof
Seneca  Joyner,female,History,Humanities,1.8,poor,The class average for our midterm was a 66 with really hard-working kids in the class. That should tell you enough but the class had an 80% drop/withdrawal rate. We started with about 35 and at the end were about 7. It was a low-level class but she taught it like it was grad level. Even if you do ALL the readings you probably won\'t do well.,class average midterm 66 really hardworking kid class tell class 80 dropwithdrawal rate start 35 end 7 lowlevel class she teach like grad level reading probably not,class average midterm 66 really hardworking kid class tell class 80 dropwithdrawal rate start 35 end 7 lowlevel class teach like grad level reading probably not,class average midterm 66 really hardworking kid class tell class 80 dropwithdrawal rate start 35 end 7 lowlevel class she teach like grad level reading probably not,class average midterm 66 really hardworking kid class tell class 80 dropwithdrawal rate start 35 end 7 lowlevel class teach like grad level reading probably not
Seneca  Joyner,female,History,Humanities,1.8,poor,She has a major attitude problem. She expects you to know everything almost word for word from readings which aren\'t easy. One time she got so upset she ended the lecture early and told us to go back and read the whole thing over when we just didn\'t understand it. Definitely can\'t advise her and I doubt her other classes will be any good.,she major attitude problem she expect know word word reading not easy time she get so upset she end lecture early tell read thing just do not understand definitely not advise her doubt her class good,major attitude problem expect know word word reading not easy time get so upset end lecture early tell read thing just do not understand definitely not advise doubt class good,she major attitude problem she expect know word word reading not NEG_easy time she get so upset she end lecture early tell read thing just do not NEG_understand definitely not NEG_advise her doubt her class good,major attitude problem expect know word word reading not NEG_easy time get so upset end lecture early tell read thing just do not NEG_understand definitely not NEG_advise doubt class good
Seneca  Joyner,female,History,Humanities,1.8,poor,"The professor is very opinionated. Requires students to do all the readings from the textbook, even IF it is not going to be covered in class. Gives stupid quizzes that everyone hated because it was over details on the readings, then she accuses the class of not reading even IF we have because the awful quiz scores. Yells at the class a lot.",professor very opinionated require student reading textbook not go cover class give stupid quiz hat detail reading she accuse class not read awful quiz score yell class lot,professor very opinionated require student reading textbook not go cover class give stupid quiz hat detail reading accuse class not read awful quiz score yell class lot,professor very opinionated require student reading textbook not NEG_go cover class give stupid quiz hat detail reading she accuse class not NEG_read awful quiz score yell class lot,professor very opinionated require student reading textbook not NEG_go cover class give stupid quiz hat detail reading accuse class not NEG_read awful quiz score yell class lot
Seneca  Joyner,female,History,Humanities,1.8,poor,"Is knowledgeable but extremely opinionated and gets angry when you dont agree with her opinions. can be very mean and is not all that helpful. lots of reading and no study guide for the exams(suggestion from her: ""Know everything"")",knowledgeable extremely opinionated get angry dont agree her opinion very mean not helpful lot read no study guide examssuggestion her know,knowledgeable extremely opinionated get angry dont agree opinion very mean not helpful lot read no study guide examssuggestion know,knowledgeable extremely opinionated get angry dont agree her opinion very mean not NEG_helpful lot read no NEG_study guide examssuggestion her know,knowledgeable extremely opinionated get angry dont agree opinion very mean not NEG_helpful lot read no NEG_study guide examssuggestion know
