professor_name,prof_gender_finalized,department_name_clean,department_domain,star_rating,star_rating_category,comments,comments_original,comments_scrubbed,comments_original_neg,comments_scrubbed_neg
Sally  Nick,female,Supplemental Instruction,Humanities,2.3,poor,Sally is really positive and friendly and works with you. She wants you not only to pass but to learn. It can be hard to focus in some of her classes because she tends to lecture and have days with little student participation. Overall a really nice lady and good teacher.,sally really positive friendly work she want not pas learn hard focus her class she tend lecture day little student participation overall really nice lady good teacher,sally really positive friendly work want not pas learn hard focus class tend lecture day little student participation overall really nice good teacher,sally really positive friendly work she want not NEG_pas learn hard focus her class she tend lecture day little student participation overall really nice lady good teacher,sally really positive friendly work want not NEG_pas learn hard focus class tend lecture day little student participation overall really nice good teacher
Sally  Nick,female,Supplemental Instruction,Humanities,2.3,poor,"Eng. Comp II. Nice lady. Actually a really good class, and assignments/projects are good too. Only real problem was first half of class is always confusing - don\'t know what you\'re doing. A little more organization would be better. She\'s a sweetheart though. Nice to see in a teacher!",eng comp ii nice lady actually really good class assignmentsprojects good too real problem half class confuse not know do little organization better she sweetheart nice teacher,eng comp ii nice actually really good class assignmentsprojects good too real problem half class confuse not know do little organization better sweetheart nice teacher,eng comp ii nice lady actually really good class assignmentsprojects good too real problem half class confuse not NEG_know do little organization better she sweetheart nice teacher,eng comp ii nice actually really good class assignmentsprojects good too real problem half class confuse not NEG_know do little organization better sweetheart nice teacher
David  Matarrita-Cascante,male,"Recreation, Parks, & Tourism",Humanities,1.0,poor,"He is very unclear with what he wants and on top of that, his expectations are unrealistic. He is back and forth with what he says and I wish he weren\'t the only professor offered for this course (I would totally drop if this were the case). I\'ve gone to every office hour he has offered",he very unclear he want his expectation unrealistic he forth he say wish he not professor offer course totally drop case go office hour he offer,very unclear want expectation unrealistic forth say wish not professor offer course totally drop case go office hour offer,he very unclear he want his expectation unrealistic he forth he say wish he not NEG_professor offer course totally drop case go office hour he offer,very unclear want expectation unrealistic forth say wish not NEG_professor offer course totally drop case go office hour offer
Brett  Rogers,male,History,Humanities,1.9,poor,"I like Mr. Rogers. I had his online class and he made things very easy. If u take his class online make sure u do the sample quizzes and memorize everything and u will do great, if u have questions Mr. Rogers got back to me very quickly I would take his class again!",like mr rogers his online class he thing very easy u his class online make sure u sample quiz memorize u great u question mr rogers get very quickly his class,like mr rogers online class thing very easy u class online make sure u sample quiz memorize u great u question mr rogers get very quickly class,like mr rogers his online class he thing very easy u his class online make sure u sample quiz memorize u great u question mr rogers get very quickly his class,like mr rogers online class thing very easy u class online make sure u sample quiz memorize u great u question mr rogers get very quickly class
Brett  Rogers,male,History,Humanities,1.9,poor,"Agh so boring, so pointless. Here\'s my impression of him during lecture: ""blah blah blah railroads and the South and the KKK blah blah blah."" He fails as a teacher.",agh so bore so pointless impression him lecture blah blah blah railroad south kkk blah blah blah he fail teacher,agh so bore so pointless impression lecture blah blah blah railroad south kkk blah blah blah fail teacher,agh so bore so pointless impression him lecture blah blah blah railroad south kkk blah blah blah he fail teacher,agh so bore so pointless impression lecture blah blah blah railroad south kkk blah blah blah fail teacher
Brett  Rogers,male,History,Humanities,1.9,poor,"I love history at Mizzou but I would NOT recommend this class. While tests and papers were easy, the lectures were painful to endure and ultimately were not at all helpful. I stopped going to lecture and taught myself from the book and finished the semester with an A. If possible take this class from a different professor. Not enjoyable!",love history mizzou not recommend class test paper easy lecture painful endure ultimately not helpful stop go lecture teach book finish semester possible class different professor not enjoyable,love history mizzou not recommend class test paper easy lecture painful endure ultimately not helpful stop go lecture teach book finish semester possible class different professor not enjoyable,love history mizzou not NEG_recommend class test paper easy lecture painful endure ultimately not NEG_helpful stop go lecture teach book finish semester possible class different professor not NEG_enjoyable,love history mizzou not NEG_recommend class test paper easy lecture painful endure ultimately not NEG_helpful stop go lecture teach book finish semester possible class different professor not NEG_enjoyable
Brett  Rogers,male,History,Humanities,1.9,poor,"Maybe I\'ve just been spoiled with good history teachers for my previous schooling, but this by far was THE WORST history class I have ever taken. Lectures were uninteresting and essentially useless, and my TA was just as bad and graded unfairly. Avoid this guy if you can unless you enjoy pointless, boring lectures. Horrible.",maybe just spoil good history teacher previous school far worst history class take lecture uninteresting essentially useless ta just bad grade unfairly avoid guy unless enjoy pointless bore lecture horrible,maybe just spoil good history teacher previous school far worst history class take lecture uninteresting essentially useless ta just bad grade unfairly avoid unless enjoy pointless bore lecture horrible,maybe just spoil good history teacher previous school far worst history class take lecture uninteresting essentially useless ta just bad grade unfairly avoid guy unless enjoy pointless bore lecture horrible,maybe just spoil good history teacher previous school far worst history class take lecture uninteresting essentially useless ta just bad grade unfairly avoid unless enjoy pointless bore lecture horrible
Brett  Rogers,male,History,Humanities,1.9,poor,"I love history, and because of that this class was alright, but overall this was not a great class. There were 400 people in my class and on any given day MAYBE 45% of people would be there because the lectures just werent very helpful. If you take this class prepare to teach yourself. Overall, not a difficult class.",love history class alright overall not great class 400 people class give day maybe 45 people lecture just werent very helpful class prepare teach overall not difficult class,love history class alright overall not great class 400 people class give day maybe 45 people lecture just werent very helpful class prepare teach overall not difficult class,love history class alright overall not NEG_great class 400 people class give day maybe 45 people lecture just werent very helpful class prepare teach overall not NEG_difficult class,love history class alright overall not NEG_great class 400 people class give day maybe 45 people lecture just werent very helpful class prepare teach overall not NEG_difficult class
Kathryn  King-Metters,female,Business,Humanities,1.0,poor,Awesome Mentor!,awesome mentor,awesome mentor,awesome mentor,awesome mentor
Maurice  Ivy,male,Business,Humanities,1.5,poor,"Very, very slow to grade. Did not find comments to be clear or helpful.",very very slow grade do not comment clear helpful,very very slow grade do not comment clear helpful,very very slow grade do not NEG_comment clear helpful,very very slow grade do not NEG_comment clear helpful
Paul  Goda,male,Law,Humanities,2.0,poor,"Avoid taking Wills & Trusts with this professor. Will provide incomprehensible handouts, illegibily scrawl explanations on white boards, and write a ridiculous final without providing a model answer beforehand.",avoid take will trust professor provide incomprehensible handout illegibily scrawl explanation white board write ridiculous final without provide model answer,avoid take will trust professor provide incomprehensible handout illegibily scrawl explanation white board write ridiculous final without provide model answer,avoid take will trust professor provide incomprehensible handout illegibily scrawl explanation white board write ridiculous final without NEG_provide model answer,avoid take will trust professor provide incomprehensible handout illegibily scrawl explanation white board write ridiculous final without NEG_provide model answer
Gerald  Beroldi,male,Psychology,Humanities,1.5,poor,"He is very judgmental, and will grade you based off of how he judges you. He is tactless, and openly disrespectful of students in class. He constantly says how worthless the book is, and teaches his own opinions as if they are facts, although he says he tries to not do so. He is also completely incomprehensible in class. His notes make zero sense.",he very judgmental grade base he judge he tactless openly disrespectful student class he constantly say worthless book teach his opinion fact he say he try not so he completely incomprehensible class his note make zero sense,very judgmental grade base judge tactless openly disrespectful student class constantly say worthless book teach opinion fact say try not so completely incomprehensible class note make zero sense,he very judgmental grade base he judge he tactless openly disrespectful student class he constantly say worthless book teach his opinion fact he say he try not NEG_so he completely incomprehensible class his note make zero sense,very judgmental grade base judge tactless openly disrespectful student class constantly say worthless book teach opinion fact say try not NEG_so completely incomprehensible class note make zero sense
Darlene  Unger,female,Education,Humanities,2.1,poor,"The first part of the course was very slow-moving and easy. Then we had a bunch of things to complete at the end of the semester. Her tests were both online, which is helpful, because we could use the textbook. However, she told us that the final would be in person; then, 30 minutes before the final was to start, she told us she wouldn\'t be there.",course very slowmoving easy bunch thing complete end semester her test online helpful use textbook she tell final person 30 minute final start she tell she not,course very slowmoving easy bunch thing complete end semester test online helpful use textbook tell final person 30 minute final start tell not,course very slowmoving easy bunch thing complete end semester her test online helpful use textbook she tell final person 30 minute final start she tell she not,course very slowmoving easy bunch thing complete end semester test online helpful use textbook tell final person 30 minute final start tell not
Darlene  Unger,female,Education,Humanities,2.1,poor,"Prof. Unger has little to no practical experience in a classroom!Her SPED policy driven lectures are quite boring and she adds no value or insight to the topic because she lacks practical experience with kids. For such a vital topic to a teacher\'s practice,she offers very little in the realm of best practices & knowledge that comes from experience!",prof unger little no practical experience classroomher speed policy drive lecture quite bore she add no value insight topic she lack practical experience kid vital topic teacher practiceshe offer very little realm best practice knowledge come experience,prof unger little no practical experience classroomher speed policy drive lecture quite bore add no value insight topic lack practical experience kid vital topic teacher practiceshe offer very little realm best practice knowledge come experience,prof unger little no NEG_practical experience classroomher speed policy drive lecture quite bore she add no NEG_value insight topic she lack practical experience kid vital topic teacher practiceshe offer very little realm best practice knowledge come experience,prof unger little no NEG_practical experience classroomher speed policy drive lecture quite bore add no NEG_value insight topic lack practical experience kid vital topic teacher practiceshe offer very little realm best practice knowledge come experience
Kathleen  Kemmerer,female,English,Humanities,1.3,poor,This is honestly the most idiotic person that have ever encountered. I spent 2 hours on a 5 page paper and got a B and my friend actually spent time on his and got a C- (and I am not good at writing). She also stares blankly into space for no reason. Avoid her.,honestly idiotic person encounter spend 2 hour 5 page paper get b friend actually spend time his get c not good write she star blankly space no reason avoid her,honestly idiotic person encounter spend 2 hour 5 page paper get b friend actually spend time get c not good write star blankly space no reason avoid,honestly idiotic person encounter spend 2 hour 5 page paper get b friend actually spend time his get c not NEG_good write she star blankly space no NEG_reason avoid her,honestly idiotic person encounter spend 2 hour 5 page paper get b friend actually spend time get c not NEG_good write star blankly space no NEG_reason avoid
Kathleen  Kemmerer,female,English,Humanities,1.3,poor,"I hate this women. She cannot teach and might actually be retarded. She also cannot write, and should not be allowed to teach composition. Bloom should fire her and send her back to middle school because she sucks! DON\'T TAKE HER!!!",hate woman she not teach actually retard she not write not allow teach composition bloom her send her middle school she suck not her,hate not teach actually retard not write not allow teach composition bloom send middle school suck not,hate woman she not NEG_teach actually retard she not NEG_write not NEG_allow teach composition bloom her send her middle school she suck not NEG_her,hate not NEG_teach actually retard not NEG_write not NEG_allow teach composition bloom send middle school suck not
Rachel  Polk,female,Business,Humanities,1.0,poor,No structure. Very little class time. 3 papers and 2 PP presentations for weekend class with no real directions.,no structure very little class time 3 paper 2 pp presentation weekend class no real direction,no structure very little class time 3 paper 2 pp presentation weekend class no real direction,no NEG_structure very little class time 3 paper 2 pp presentation weekend class no NEG_real direction,no NEG_structure very little class time 3 paper 2 pp presentation weekend class no NEG_real direction
Jennie  Jarvis,female,Film,Humanities,1.9,poor,"What a joke. She is a washed up hack who could not make it in Los Angeles. She likes to tell stories like she actually made in Hollywood, but I have been out here five years since graduating, and every time I see a fake Hollywood egomaniac with no talent, I think of the class I took with her. Pass",joke she wash hack not make los angeles she like tell story like she actually hollywood year graduate time fake hollywood egomaniac no talent think class take her pas,joke wash hack not make los angeles like tell story like actually hollywood year graduate time fake hollywood egomaniac no talent think class take pas,joke she wash hack not NEG_make los angeles she like tell story like she actually hollywood year graduate time fake hollywood egomaniac no NEG_talent think class take her pas,joke wash hack not NEG_make los angeles like tell story like actually hollywood year graduate time fake hollywood egomaniac no NEG_talent think class take pas
Jennie  Jarvis,female,Film,Humanities,1.9,poor,She was an excellent teacher for screenwriting. She jokes around a lot and made the class tons of fun. And she knows the material well from past experiences. I recommend this class for anyone with any interest in films and/or scripts.,she excellent teacher screenwriting she joke lot class ton fun she know material past experience recommend class film andor script,excellent teacher screenwriting joke lot class ton fun know material past experience recommend class film andor script,she excellent teacher screenwriting she joke lot class ton fun she know material past experience recommend class film andor script,excellent teacher screenwriting joke lot class ton fun know material past experience recommend class film andor script
Jennie  Jarvis,female,Film,Humanities,1.9,poor,"I\'m not sure why she gets such a bad rap on this site. Granted she is a stickler for being on time and not using your cell phone and she does tend to talk about herself a lot, but I really liked this class. I don\'t think she\'s that bad. She does tend to grade tough though. But the class was fun.",not sure she get bad rap site grant she stickler time not use cell phone she do tend talk lot really like class not think she bad she do tend grade tough class fun,not sure get bad rap site grant stickler time not use cell phone do tend talk lot really like class not think bad do tend grade tough class fun,not NEG_sure she get bad rap site grant she stickler time not NEG_use cell phone she do tend talk lot really like class not NEG_think she bad she do tend grade tough class fun,not NEG_sure get bad rap site grant stickler time not NEG_use cell phone do tend talk lot really like class not NEG_think bad do tend grade tough class fun
Jennie  Jarvis,female,Film,Humanities,1.9,poor,Kermit the Frog!,kermit frog,kermit frog,kermit frog,kermit frog
Jennie  Jarvis,female,Film,Humanities,1.9,poor,"DO NOT TAKE A CLASS WITH HER UNLESS YOU HAVE TOO. SHe will mark you absent if you are even one second late! She is mean and talks down to her students, she must have been picked on in high school because she now takes it out on us. She wasnt even the prof! Good luck",not class her unless too she mark absent second late she mean talk her student she pick high school she take she wasnt prof good luck,not class unless too mark absent second late mean talk student pick high school take wasnt prof good luck,not NEG_class her unless too she mark absent second late she mean talk her student she pick high school she take she wasnt prof good luck,not NEG_class unless too mark absent second late mean talk student pick high school take wasnt prof good luck
Jennie  Jarvis,female,Film,Humanities,1.9,poor,"She completely ruined it for me. Terrible in all aspects. For the love of your sanity, pass on her or else you may become suicidal if left in a room with her for extended periods of time!",she completely ruin terrible aspect love sanity pas her suicidal leave room her extend period time,completely ruin terrible aspect love sanity pas suicidal leave room extend period time,she completely ruin terrible aspect love sanity pas her suicidal leave room her extend period time,completely ruin terrible aspect love sanity pas suicidal leave room extend period time
Jennie  Jarvis,female,Film,Humanities,1.9,poor,"She was the TA in my film class...she\'s completely ridiculous. Her grading is so hard it is impossible to get above a C and her lame personality makes her all the harder to stand. If I knew I would be stuck with her, I would have passed on the class.",she ta film classshe completely ridiculous her grade so hard impossible c her lame personality make her harder stand know stick her pas class,ta film classshe completely ridiculous grade so hard impossible c lame personality make harder stand know stick pas class,she ta film classshe completely ridiculous her grade so hard impossible c her lame personality make her harder stand know stick her pas class,ta film classshe completely ridiculous grade so hard impossible c lame personality make harder stand know stick pas class
Jennie  Jarvis,female,Film,Humanities,1.9,poor,"Hands down one of the most stubborn, worst professors I have ever heard had. She has a massive ego and constantly talks about her time working in LA, but if she was even remotely decent in the film industry she would still be there. She\'s arrogant, egotisitical, and a bad teacher. She has NO CLUE what she is talking about. She needs to be fired",hand stubborn worst professor hear she massive ego constantly talk her time work la she remotely decent film industry she she arrogant egotisitical bad teacher she no clue she talk she need fire,hand stubborn worst professor hear massive ego constantly talk time work la remotely decent film industry arrogant egotisitical bad teacher no clue talk need fire,hand stubborn worst professor hear she massive ego constantly talk her time work la she remotely decent film industry she she arrogant egotisitical bad teacher she no NEG_clue she talk she need fire,hand stubborn worst professor hear massive ego constantly talk time work la remotely decent film industry arrogant egotisitical bad teacher no NEG_clue talk need fire
Gary  Hearne,male,Economics,Humanities,2.0,poor,Easy to learn with him.,easy learn him,easy learn,easy learn him,easy learn
Gary  Hearne,male,Economics,Humanities,2.0,poor,Avoid Gary Hearne. He is an awful lecturer and he is also very rude.,avoid gary hearne he awful lecturer he very rude,avoid gary hearne awful lecturer very rude,avoid gary hearne he awful lecturer he very rude,avoid gary hearne awful lecturer very rude
Gary  Hearne,male,Economics,Humanities,2.0,poor,Avoid Gary Hearne at all costs. He\'s a terrible lecturer and he\'s extremely rude and a bullies students,avoid gary hearne cost he terrible lecturer he extremely rude bully student,avoid gary hearne cost terrible lecturer extremely rude bully student,avoid gary hearne cost he terrible lecturer he extremely rude bully student,avoid gary hearne cost terrible lecturer extremely rude bully student
Jeremy  Bonner,male,History,Humanities,1.3,poor,"This man has NO idea what he is doing. Worst teacher ever. He always switches the syllabus and misspeaks leaving everyone confused. I never knew when the quizes in his class where because he is SO unclear and his syllabus is SO unreliable. Also, he ramble\'s in class so come test time, you dont know whats on it. His Study guides SUCK!",man no idea he do worst teacher he switch syllabus misspeak leave confuse never know quiz his class he so unclear his syllabus so unreliable he ramble class so come test time dont know whats his study guide suck,no idea do worst teacher switch syllabus misspeak leave confuse never know quiz class so unclear syllabus so unreliable ramble class so come test time dont know whats study guide suck,man no NEG_idea he do worst teacher he switch syllabus misspeak leave confuse never NEG_know quiz his class he so unclear his syllabus so unreliable he ramble class so come test time dont know whats his study guide suck,no NEG_idea do worst teacher switch syllabus misspeak leave confuse never NEG_know quiz class so unclear syllabus so unreliable ramble class so come test time dont know whats study guide suck
Jeremy  Bonner,male,History,Humanities,1.3,poor,"Bad Grader. Never looks at students and doesn\'t answer questions. Lectures on and on in a drony voice (all the while staring at the ceiling) Creates very UNhelpful slideshows. Very wordy, from england, Makes mistakes all the time, changes books in the middle of the course. VERY BORING!! NOT WORTH YOUR TIME/MONEY or SYMPATHY (Worst teacher ever!)",bad grader never look student do not answer question lecture drony voice star ceiling create very unhelpful slideshows very wordy england make mistake time change book middle course very bore not worth timemoney sympathy worst teacher,bad grader never look student do not answer question lecture drony voice star ceiling create very unhelpful slideshows very wordy england make mistake time change book middle course very bore not worth timemoney sympathy worst teacher,bad grader never NEG_look student do not NEG_answer question lecture drony voice star ceiling create very unhelpful slideshows very wordy england make mistake time change book middle course very bore not NEG_worth timemoney sympathy worst teacher,bad grader never NEG_look student do not NEG_answer question lecture drony voice star ceiling create very unhelpful slideshows very wordy england make mistake time change book middle course very bore not NEG_worth timemoney sympathy worst teacher
Wallace  Gatewood,male,Business,Humanities,1.2,poor,"I have Dr. Gatewood at NDM, and he is horrible. Changed the course outline beyond recognition, gave us a 30 page research paper to write in 2 weeks, NEVER responds to emails.",dr gatewood ndm he horrible change course outline recognition give 30 page research paper write 2 week never respond email,dr gatewood ndm horrible change course outline recognition give 30 page research paper write 2 week never respond email,dr gatewood ndm he horrible change course outline recognition give 30 page research paper write 2 week never NEG_respond email,dr gatewood ndm horrible change course outline recognition give 30 page research paper write 2 week never NEG_respond email
