professor_name,prof_gender_finalized,department_name_clean,department_domain,star_rating,star_rating_category,comments,comments_original,comments_scrubbed,comments_original_neg,comments_scrubbed_neg
Adeline  Ortiz,female,Business,Humanities,2.4,poor,"This is a tough course and tough professor, but a fair one. You always know where you stand. If you do your part she will meet you half way. If you think you can blow off reading and classes, you picked the wrong instructor!! She knows her stuff and she\'s great at what she does. Only slackers have a problem with her!",tough course tough professor fair know stand she meet half way think blow read class pick wrong instructor she know her stuff she great she do slacker problem her,tough course tough professor fair know stand meet half way think blow read class pick wrong instructor know stuff great do slacker problem,tough course tough professor fair know stand she meet half way think blow read class pick wrong instructor she know her stuff she great she do slacker problem her,tough course tough professor fair know stand meet half way think blow read class pick wrong instructor know stuff great do slacker problem
Adeline  Ortiz,female,Business,Humanities,2.4,poor,"She is horrible!! do not recommend taking this class with her. I took it online. I was an accelerated course so it was a lot of work. But if for some reason you need some help or an emergency happens and you need more time to submit your work, she will not help!!",she horrible not recommend take class her take online accelerate course so lot work reason need help emergency happen need time submit work she not help,horrible not recommend take class take online accelerate course so lot work reason need help emergency happen need time submit work not help,she horrible not NEG_recommend take class her take online accelerate course so lot work reason need help emergency happen need time submit work she not NEG_help,horrible not NEG_recommend take class take online accelerate course so lot work reason need help emergency happen need time submit work not NEG_help
Adeline  Ortiz,female,Business,Humanities,2.4,poor,Great Professor,great professor,great professor,great professor,great professor
Adeline  Ortiz,female,Business,Humanities,2.4,poor,"She is tough cookie, if you want an A, you better be a real student, don\'t take her lightly.",she tough cookie want better real student not her lightly,tough cookie want better real student not lightly,she tough cookie want better real student not NEG_her lightly,tough cookie want better real student not NEG_lightly
Adeline  Ortiz,female,Business,Humanities,2.4,poor,This professor is by far THE WORST professor I\'ve ever had in my life she looses your papers and hold you responsible to resubmit them as in her course is your only course and you don\'t have a life . She complains about lateness but was always late to the classes we had she didn\'t know how to use blackboard and held us liable for her tactfulness . She knows her work and could be a good professor if shed stop trying to be a lawyer in a Business class. Horrible if your signed up drop it ASAP!,professor far worst professor life she loose paper hold responsible resubmit her course course not life she complain lateness late class she do not know use blackboard hold liable her tactfulness she know her work good professor shed stop try lawyer business class horrible sign drop asap,professor far worst professor life loose paper hold responsible resubmit course course not life complain lateness late class do not know use blackboard hold liable tactfulness know work good professor shed stop try lawyer business class horrible sign drop asap,professor far worst professor life she loose paper hold responsible resubmit her course course not NEG_life she complain lateness late class she do not NEG_know use blackboard hold liable her tactfulness she know her work good professor shed stop try lawyer business class horrible sign drop asap,professor far worst professor life loose paper hold responsible resubmit course course not NEG_life complain lateness late class do not NEG_know use blackboard hold liable tactfulness know work good professor shed stop try lawyer business class horrible sign drop asap
Adeline  Ortiz,female,Business,Humanities,2.4,poor,This professor is very unfair and inconsistent.,professor very unfair inconsistent,professor very unfair inconsistent,professor very unfair inconsistent,professor very unfair inconsistent
Adeline  Ortiz,female,Business,Humanities,2.4,poor,"This is the worst professor ever. She has no idea what she is doing. She loses homework and blames it on the students. She made my semester so frustrating.I do not know what my grade for her class is, because as usual, she is late in grading assignments. There is not enough space here to list how I feel about this professor\'s teaching style.",worst professor she no idea she do she lose homework blame student she semester so frustratingi not know grade her class usual she late grade assignment not space list feel professor teach style,worst professor no idea do lose homework blame student semester so frustratingi not know grade class usual late grade assignment not space list feel professor teach style,worst professor she no NEG_idea she do she lose homework blame student she semester so frustratingi not NEG_know grade her class usual she late grade assignment not NEG_space list feel professor teach style,worst professor no NEG_idea do lose homework blame student semester so frustratingi not NEG_know grade class usual late grade assignment not NEG_space list feel professor teach style
Adeline  Ortiz,female,Business,Humanities,2.4,poor,She is a tough cookie and her test are hard. You should stay on top of the reading all semester because if you wait to study the night before a test you will be screwed. Her passing grade is a 70 and her test are long and hard. She is a pretty cool professor overall.,she tough cookie her test hard stay read semester wait study night test screw her pas grade 70 her test long hard she pretty cool professor overall,tough cookie test hard stay read semester wait study night test screw pas grade 70 test long hard pretty cool professor overall,she tough cookie her test hard stay read semester wait study night test screw her pas grade 70 her test long hard she pretty cool professor overall,tough cookie test hard stay read semester wait study night test screw pas grade 70 test long hard pretty cool professor overall
Adeline  Ortiz,female,Business,Humanities,2.4,poor,She is the worst professor in the business dept. I passed both midterm and finals with B+ and she gave me a C+ for a final grade. She doesn\'t care for her students and doesn\'t care to fail anyone. Pathetice professor don\'t waste your time.,she worst professor business dept pas midterm final b she give c final grade she do not care her student do not care fail pathetice professor not waste time,worst professor business dept pas midterm final b give c final grade do not care student do not care fail pathetice professor not waste time,she worst professor business dept pas midterm final b she give c final grade she do not NEG_care her student do not NEG_care fail pathetice professor not NEG_waste time,worst professor business dept pas midterm final b give c final grade do not NEG_care student do not NEG_care fail pathetice professor not NEG_waste time
Adeline  Ortiz,female,Business,Humanities,2.4,poor,This must be the worst professor in the Business Dept. I believe she was known as Professor Pina. I got an 85 on my midterm and she gave me a C+ as a final grade. All she does is speak of her personal life. Please stay away.,worst professor business dept believe she know professor pina get 85 midterm she give c final grade she do speak her personal life stay away,worst professor business dept believe know professor pina get 85 midterm give c final grade do speak personal life stay away,worst professor business dept believe she know professor pina get 85 midterm she give c final grade she do speak her personal life stay away,worst professor business dept believe know professor pina get 85 midterm give c final grade do speak personal life stay away
Eric  Sandras,female,Child & Family Studies,Humanities,2.3,poor,Se doen not explain with xamples She also does not like to write on the board. She gives homework alot more then any other teacher teacng the same subject. She wants the students write papers like college graduates. She is really bad teachig. I have her fro second time and 90% of the class is about to drop the class.CFE 104 take with other teache.,se doen not explain xamples she do not like write board she give homework alot teacher teacng subject she want student write paper like college graduate she really bad teachig her fro second time 90 class drop classcfe 104 teache,se doen not explain xamples do not like write board give homework alot teacher teacng subject want student write paper like college graduate really bad teachig fro second time 90 class drop classcfe 104 teache,se doen not NEG_explain xamples she do not NEG_like write board she give homework alot teacher teacng subject she want student write paper like college graduate she really bad teachig her fro second time 90 class drop classcfe 104 teache,se doen not NEG_explain xamples do not NEG_like write board give homework alot teacher teacng subject want student write paper like college graduate really bad teachig fro second time 90 class drop classcfe 104 teache
Craig  Feiser,male,First Amendment,Humanities,1.3,poor,"My view is that he is simply a bad professor, there is nothing more to say about that. I had him for First Amendment.",view he simply bad professor say him amendment,view simply bad professor say amendment,view he simply bad professor say him amendment,view simply bad professor say amendment
Craig  Feiser,male,First Amendment,Humanities,1.3,poor,"Absolutely horrible prof. I agree with other person above. If not the worst, one of the worst profs I have ever had. It\'s dumbfounding that he is still allowed to teach. Hint: Check the test bank b/c he may offer the SAME exact exam as he did the previous two years. Wow, talk about laziness.",absolutely horrible prof agree person not worst worst prof dumbfound he allow teach hint check test bank bc he offer exact exam he do previous year wow talk laziness,absolutely horrible prof agree person not worst worst prof dumbfound allow teach hint check test bank bc offer exact exam do previous year wow talk laziness,absolutely horrible prof agree person not NEG_worst worst prof dumbfound he allow teach hint check test bank bc he offer exact exam he do previous year wow talk laziness,absolutely horrible prof agree person not NEG_worst worst prof dumbfound allow teach hint check test bank bc offer exact exam do previous year wow talk laziness
Craig  Feiser,male,First Amendment,Humanities,1.3,poor,"I had Prof. Feiser for First Amendment. He is definitely one of the worst professors I have had. Take someone who doesn\'t know their subject and then add a rambling, incomprehensible teaching style and that sums him up. HE SHOULD NOT BE TEACHING LAW.",prof feiser amendment he definitely worst professor do not know subject add ramble incomprehensible teach style sum him he not teach law,prof feiser amendment definitely worst professor do not know subject add ramble incomprehensible teach style sum not teach law,prof feiser amendment he definitely worst professor do not NEG_know subject add ramble incomprehensible teach style sum him he not NEG_teach law,prof feiser amendment definitely worst professor do not NEG_know subject add ramble incomprehensible teach style sum not NEG_teach law
Christina  Chi,female,Hotel & Restaurant Management,Humanities,2.4,poor,"She did not seem knowledgeable in her field, they should find somebody to replace her.",she do not knowledgeable her field somebody replace her,do not knowledgeable field somebody replace,she do not NEG_knowledgeable her field somebody replace her,do not NEG_knowledgeable field somebody replace
Christina  Chi,female,Hotel & Restaurant Management,Humanities,2.4,poor,Cons: Very difficult class with a lot of assignments. Grades extremely hard. Lots of homework. Pros: VERY sweet lady. Will help whenever you ask for it. Will listen to your concerns. Is open. Provides chance to get the CHIA certification (great opportunity for HBM!) Friendly,con very difficult class lot assignment grade extremely hard lot homework pro very sweet lady help ask listen concern open provide chance chia certification great opportunity hbm friendly,con very difficult class lot assignment grade extremely hard lot homework pro very sweet help ask listen concern open provide chance chia certification great opportunity hbm friendly,con very difficult class lot assignment grade extremely hard lot homework pro very sweet lady help ask listen concern open provide chance chia certification great opportunity hbm friendly,con very difficult class lot assignment grade extremely hard lot homework pro very sweet help ask listen concern open provide chance chia certification great opportunity hbm friendly
Christina  Chi,female,Hotel & Restaurant Management,Humanities,2.4,poor,"Christina is very helpful and will almost do the assignment for you if you ask, but if you don\'t ask, you will struggle. She is hard to understand, but if you make note of the things she mentions multiple times, 9 out of 10, it will be on the exam. She is one of the better professors in the hospitality department, but the subject matter is hard.",christina very helpful assignment ask not ask struggle she hard understand make note thing she mention multiple time 9 10 exam she better professor hospitality department subject matter hard,christina very helpful assignment ask not ask struggle hard understand make note thing mention multiple time 9 10 exam better professor hospitality department subject matter hard,christina very helpful assignment ask not NEG_ask struggle she hard understand make note thing she mention multiple time 9 10 exam she better professor hospitality department subject matter hard,christina very helpful assignment ask not NEG_ask struggle hard understand make note thing mention multiple time 9 10 exam better professor hospitality department subject matter hard
Christina  Chi,female,Hotel & Restaurant Management,Humanities,2.4,poor,Very boring class with a terrible teacher. HW every single day.,very bore class terrible teacher hw single day,very bore class terrible teacher hw single day,very bore class terrible teacher hw single day,very bore class terrible teacher hw single day
Christina  Chi,female,Hotel & Restaurant Management,Humanities,2.4,poor,"Difficult to understand. ""franchise"" sounds remarkably like ""french fries"". the class is dry and Chi can be monotone at times. Do NOT waste $$ on the book. The class is based mostly off of powerpoint and a few hw problems come from the book. Stay focused during class and you\'ll do fine.",difficult understand franchise sound remarkably like french fry class dry chi monotone time not waste book class base powerpoint hw problem come book stay focus class fine,difficult understand franchise sound remarkably like french fry class dry chi monotone time not waste book class base powerpoint hw problem come book stay focus class fine,difficult understand franchise sound remarkably like french fry class dry chi monotone time not NEG_waste book class base powerpoint hw problem come book stay focus class fine,difficult understand franchise sound remarkably like french fry class dry chi monotone time not NEG_waste book class base powerpoint hw problem come book stay focus class fine
Christina  Chi,female,Hotel & Restaurant Management,Humanities,2.4,poor,Please do yourself a favor and save yourself from hours of extreme boredom. Very hard to understand and she has very poor listening skills. Material is hard to understand.,favor save hour extreme boredom very hard understand she very poor listen skill material hard understand,favor save hour extreme boredom very hard understand very poor listen skill material hard understand,favor save hour extreme boredom very hard understand she very poor listen skill material hard understand,favor save hour extreme boredom very hard understand very poor listen skill material hard understand
Christina  Chi,female,Hotel & Restaurant Management,Humanities,2.4,poor,"So boring and dry, attendance is required",so bore dry attendance require,so bore dry attendance require,so bore dry attendance require,so bore dry attendance require
Christina  Chi,female,Hotel & Restaurant Management,Humanities,2.4,poor,"Hard to understand sometimes due to Chinese accent, can be monotone and boring at times. Class is based on powerpoints don.t waste money on the book. Otherwise she is a very nice person who will try to get to know you and is willing to help in any way she can. Keep yourself focused in the class and you will do well.",hard understand chinese accent monotone bore time class base powerpoints dont waste money book she very nice person try know will help way she focus class,hard understand chinese accent monotone bore time class base powerpoints dont waste money book very nice person try know will help way focus class,hard understand chinese accent monotone bore time class base powerpoints dont waste money book she very nice person try know will help way she focus class,hard understand chinese accent monotone bore time class base powerpoints dont waste money book very nice person try know will help way focus class
Christina  Chi,female,Hotel & Restaurant Management,Humanities,2.4,poor,"Sometimes difficult understand her accent. Her tests are worded confusingly. In class she just talks and talks about the slides, and it gets hard to focus.",difficult understand her accent her test word confusingly class she just talk talk slide get hard focus,difficult understand accent test word confusingly class just talk talk slide get hard focus,difficult understand her accent her test word confusingly class she just talk talk slide get hard focus,difficult understand accent test word confusingly class just talk talk slide get hard focus
Christina  Chi,female,Hotel & Restaurant Management,Humanities,2.4,poor,Easiest class I\'ve ever taken. Tests straight of powerpoint lecture slides.Study the night before test briefly and you will have no problem getting A\'s. One group project during the semester. Points for attendance. Sometimes her accent makes it hard to understand what she\'s saying,easiest class take test straight powerpoint lecture slidesstudy night test briefly no problem get group project semester point attendance her accent make hard understand she say,easiest class take test straight powerpoint lecture slidesstudy night test briefly no problem get group project semester point attendance accent make hard understand say,easiest class take test straight powerpoint lecture slidesstudy night test briefly no NEG_problem get group project semester point attendance her accent make hard understand she say,easiest class take test straight powerpoint lecture slidesstudy night test briefly no NEG_problem get group project semester point attendance accent make hard understand say
Christina  Chi,female,Hotel & Restaurant Management,Humanities,2.4,poor,Easy class. Tests are straight off of notes. Dont really need to go to class. Just study a little bit and you will be fine.,easy class test straight note dont really need class just study little bite fine,easy class test straight note dont really need class just study little bite fine,easy class test straight note dont really need class just study little bite fine,easy class test straight note dont really need class just study little bite fine
Natasha  Assa,female,History,Humanities,2.0,poor,if you want to lower your average take this class. she gives low grades to almost everyone,want lower average class she give low grade,want lower average class give low grade,want lower average class she give low grade,want lower average class give low grade
Pat  Seitz,female,Business,Humanities,1.5,poor,"Pat is nice, but has no idea what she is ever talking about. Do not take her unless you have to. She does not understand the material.",pat nice no idea she talk not her unless she do not understand material,pat nice no idea talk not unless do not understand material,pat nice no NEG_idea she talk not NEG_her unless she do not NEG_understand material,pat nice no NEG_idea talk not NEG_unless do not NEG_understand material
Lea  Ausch Alteras,female,Education,Humanities,2.3,poor,"She\'s really not as bad as the previous comments. Ausch does come off a bit intimidating but really she\'s a softy. As long as you do your work, you\'ll be fine. Almost everyone in the class got an A on their observation. She comes from a different backround than most prof. being that shes a psych. But this is college so no whining!",she really not bad previous comment ausch do come bite intimidate really she softy long work fine class get observation she come different backround prof shes psych college so no whine,really not bad previous comment ausch do come bite intimidate really softy long work fine class get observation come different backround prof psych college so no whine,she really not NEG_bad previous comment ausch do come bite intimidate really she softy long work fine class get observation she come different backround prof shes psych college so no NEG_whine,really not NEG_bad previous comment ausch do come bite intimidate really softy long work fine class get observation come different backround prof psych college so no NEG_whine
Lea  Ausch Alteras,female,Education,Humanities,2.3,poor,AVOID HER! She is a terrible teacher and is not helpful at all. She is very unclear of what she wants from you and basically leaves you to stress trying to figure it out. She does not follow the grading breakdown given in her syllabus and makes grades up her own way. She also refuses to email you back explaining your grade. STAY AWAY!,avoid her she terrible teacher not helpful she very unclear she want basically leave stress try figure she do not follow grade breakdown give her syllabus make grade her way she refuse email explain grade stay away,avoid terrible teacher not helpful very unclear want basically leave stress try figure do not follow grade breakdown give syllabus make grade way refuse email explain grade stay away,avoid her she terrible teacher not NEG_helpful she very unclear she want basically leave stress try figure she do not NEG_follow grade breakdown give her syllabus make grade her way she refuse email explain grade stay away,avoid terrible teacher not NEG_helpful very unclear want basically leave stress try figure do not NEG_follow grade breakdown give syllabus make grade way refuse email explain grade stay away
Lea  Ausch Alteras,female,Education,Humanities,2.3,poor,"She is tough, but fair I have found in the end.She has very low tolerance for nonsense and b.s. She gives plenty of fair warning however with regards to assignments & pays close attention to attendance.",she tough fair endshe very low tolerance nonsense b she give plenty fair warn regard assignment pay close attention attendance,tough fair endshe very low tolerance nonsense b give plenty fair warn regard assignment pay close attention attendance,she tough fair endshe very low tolerance nonsense b she give plenty fair warn regard assignment pay close attention attendance,tough fair endshe very low tolerance nonsense b give plenty fair warn regard assignment pay close attention attendance
Lea  Ausch Alteras,female,Education,Humanities,2.3,poor,"This lady was dreadful. She was so unclear and did not want to help me at all with my paper topic. I asked her once to approve my lesson plan for field work and she totally did not give me feedback. When I taught the lesson, she was not even paying attention. I cannot believe she is a professor at Hunter College.",lady dreadful she so unclear do not want help paper topic ask her approve lesson plan field work she totally do not feedback teach lesson she not pay attention not believe she professor hunter college,dreadful so unclear do not want help paper topic ask approve lesson plan field work totally do not feedback teach lesson not pay attention not believe professor hunter college,lady dreadful she so unclear do not NEG_want help paper topic ask her approve lesson plan field work she totally do not NEG_feedback teach lesson she not NEG_pay attention not NEG_believe she professor hunter college,dreadful so unclear do not NEG_want help paper topic ask approve lesson plan field work totally do not NEG_feedback teach lesson not NEG_pay attention not NEG_believe professor hunter college
Lea  Ausch Alteras,female,Education,Humanities,2.3,poor,"Very helpful. Email problems seem to be more of a technology issue for her than her unwilling to help - she is the ONLY quest teacher who can do a darn good lecture, stands up 200% for her students, and treats you like you have a brain. You\'ll need a brain to get an A, but if you have one, you\'re just fine.",very helpful email problem technology issue her her unwilling help she quest teacher darn good lecture stand 200 her student treat like brain need brain just fine,very helpful email problem technology issue unwilling help quest teacher darn good lecture stand 200 student treat like brain need brain just fine,very helpful email problem technology issue her her unwilling help she quest teacher darn good lecture stand 200 her student treat like brain need brain just fine,very helpful email problem technology issue unwilling help quest teacher darn good lecture stand 200 student treat like brain need brain just fine
